question_id,question_text,response_type_id,is_multiselect,rating_min,rating_max,is_mandatory
302,Would child like to design a different type of vehicle next time?,Radio Button,false,,,false
303,,,false,,,false
304,Was child able to repurpose waste material to make a dream catcher?,Radio Button,false,,,false
305,Would child like to make a more decorative dream catcher or add variations to design next time?,Radio Button,false,,,false
306,Did child read extra information to understand this topic better?,Radio Button,false,,,false
307,Would child like to do a similar activity with life stages of different insects?,Radio Button,false,,,false
308,Was child curious while setting up this activity in a Ziploc bag?,Radio Button,false,,,false
309, Did child record their observations?,Radio Button,false,,,false
310,Did child enjoy cutting and shaping the Oreo cream?,Radio Button,false,,,false
311,Could child arrange the moons in correct order?,Radio Button,false,,,false
312,Could child make good impressions by rubbing? ,Radio Button,false,,,false
313,Did child do the calculations well?,Radio Button,false,,,false
314,Was child able to understand why water comes out when cap is loosened?,Radio Button,false,,,false
315,Did child try to use the water fountain for any specific purpose like watering the plants/ giving water to birds and animals?,Radio Button,false,,,false
316,Was child involved actively in this activity?,Radio Button,false,,,false
317,Did child use 7 to decorate the stand?,Radio Button,false,,,false
318,What part of this activity did child show interest in?,Radio Button,false,,,false
319,Did child understand why the sun started spinning?,Radio Button,false,,,false
320,Were you expecting water to rise in the jar?,Radio Button,false,,,false
321,What do you think was the reason for water rising in the jar?,Text Box,false,,,false
322,Did you expect the plate to stick to the jar?,Radio Button,false,,,false
323,What do you think is the reason for the plate to stick to the glass jar?,Text Box,false,,,false
324,Was child able to assemble the well together?,Radio Button,false,,,false
325,Was child amazed to learn about the functioning of a well?,Radio Button,false,,,false
326, What was your favourite part of the activity?,Radio Button,false,,,false
327, How did you feel assigning tasks to all the family members? Did you find it to be easy or challenging?,Radio Button,false,,,false
328, Why do you think the balloon moved across the string?,Radio Button,false,,,false
329,,,false,,,false
330, What did you observe during the reaction between the baking soda and vinegar?,Checkbox,true,,,false
331, Why do you think the volcano erupted?,Text Box,false,,,false
332,Why do you think the pepper was attracted to the comb or balloon?,Radio Button,false,,,false
333,Would you like to explore more experiments involving static electricity in the future? ,Radio Button,false,,,false
334,Did you understand the science behind why the balloon inflated?,Radio Button,false,,,false
335,Do you feel confident teaching this experiment to a group of younger kids?,Radio Button,false,,,false
336,Why do you think the ball was able to float in the air stream?,Radio Button,false,,,false
337, How did changing the angle of the hair dryer affect the ball's behaviour?,Radio Button,false,,,false
338,What did you learn about in this activity?,Checkbox,true,,,false
339,Would you like to demonstrate this activity independently in school or in front of friends?,Radio Button,false,,,false
340, How did the salt affect the ice cube?,Radio Button,false,,,false
341,Did you learn about melting temperature of ice in this experiment?,Radio Button,false,,,false
342,Why do you think the bad did not leak?,Radio Button,false,,,false
343,What new science concept did you learn today,Text Box,false,,,false
344, How did the speaker change the sound from your device?,Checkbox,true,,,false
345, Can you think of any variations of this activity?,Text Box,false,,,false
346,Would you like to make similar toys with various sizes of paper?,Radio Button,false,,,false
347,Would you like to teach this activity to younger kids?,Radio Button,false,,,false
348,Were you able to construct the boat without help?,Radio Button,false,,,false
349,Would you like to make different boat designs using the same material?,Radio Button,false,,,false
350,Did you follow all steps of the activity patiently?,Radio Button,false,,,false
351,Would you be able to demonstrate this activity to  a friend?,Radio Button,false,,,false
352,Did you follow all steps of the activity patiently?,Radio Button,false,,,false
353,Would you like to make more such furniture pieces using straws?,Radio Button,false,,,false
354,Could you solve the puzzles?,Radio Button,false,,,false
355, Did you think of any puzzles and challenge parent?,Radio Button,false,,,false
356, Were you interested throughout the process of making the house?,Radio Button,false,,,false
357,Did you think of any other waste material that can be used to make a house? What was it?,Text Box,false,,,false
358,Did you understand the reason behind this bubbling volcano?,Radio Button,false,,,false
359,Would you like to demonstrate this experiment to friends and family?,Radio Button,false,,,false
360, Did your bridge turn out the way you expected it to?  ,Radio Button,false,,,false
361,What were some of the challenges you faced while building your bridge?,Checkboxes,false,,,false
362,How did you feel  during the experiment with the paper clip switch? ,Radio Button,false,,,false
363,Can you think of other such simple experiments you can try at home?,Text Box,false,,,false
364,What part of this activity did you enjoy the most?,Radio Button,false,,,false
365,an you think of other ways to design the catapult?,Radio Button,false,,,false
366,Were you able to catch the cardboard squares promptly?,Radio Button,false,,,false
367,Would you like to do similar activities to sharpen their reflexes?,Radio Button,false,,,false
368,Were you curious to see what happens in this experiment?,Radio Button,false,,,false
369,What do you think is the reason for the bottle shoot?,Text Box,false,,,false
370,Did you try out several permutations and combinations to get the experiment right?,Radio Button,false,,,false
371,Would you like to share your experiences?,Text Box,false,,,false
