question_id,question_text,response_type_id,is_multiselect,rating_min,rating_max,is_mandatory
0,Did your child learn any new shapes or figures while performing the activity?,Radio Button,false,,,false
1,What was  one specific aspect of the activity that your child found exciting or fun?,Checkbox,true,,,false
2,Did your child react to the different textures of the sponge and the paint on their hands?,Radio Button,false,,,false
3,Did your child use the space well and arrange shapes well on the paper?,Radio Button,false,,,false
4, On which line your child movements were the best?,Radio Button,false,,,false
5,Did your child seem engaged and focused during the activity?,Radio Button,false,,,false
6, What did your child enjoy the most about using an old toothbrush and paint?,Checkbox,true,,,false
7,Did child seem interested to do this new painting technique again?,Radio Button,false,,,false
8,What did your child enjoy the most while playing with the dough?,Checkbox,true,,,false
9, How did your child react to the different colours? Did it enhance their interest in the activity?,Radio Button,false,,,false
10,How did the child feel after taking out the toys out successfully?,Radio Button,false,,,false
11,Did child show any preference of hand while doing this activity?,Radio Button,false,,,false
12,Do you feel that this activity contributed to family bonding?,Radio Button,false,,,false
13,How did they explore and experiment with creating bubbles?,Text Box,false,,,false
14,Did they seem engaged and interested in the process?,Radio Button,false,,,false
15,Did your child show excitement or anticipation about using the calming bottle when feeling restless?,Radio Button,false,,,false
16, Did child come up with any ideas or did they ask you?,Radio Button,false,,,false
17,Would child be interested to make greeting cards using this technique?,Radio Button,false,,,false
18,Did child experiment with different colours?,Radio Button,false,,,false
19, Did they try to make different designs?,Radio Button,false,,,false
20,Did child do this activity with ease?,Radio Button,false,,,false
21,Did child want to do it again after finishing?,Radio Button,false,,,false
22,What part of this activity did child enjoy the most?,Radio Button,false,,,false
23,Have you noticed any change in child's mood after this activity?,Radio Button,false,,,false
24,What did child enjoy more?,Radio Button,false,,,false
25,Would child like to make more bookmarks to gift to friends and family?,Radio Button,false,,,false
26,How many animals did child make?,Radio Button,false,,,false
27,Would child like to arrange a puppet show with these animals?,Radio Button,false,,,false
28,Was child focused and patient throughout the activity?,Radio Button,false,,,false
29,Does child show any preference while using hand?,Radio Button,false,,,false
30,How many shapes could child make with the sticks?,Radio Button,false,,,false
31,Did child also try to make any other design with the sticks?,Radio Button,false,,,false
32, Was child able to balance the sticks on a fork?,Radio Button,false,,,false
33,How many times did child drop the sticks?,Radio Button,false,,,false
34, Did child colour the rainbow well? ,Radio Button,false,,,false
35,was child excited to see the rainbow lights?,Radio Button,false,,,false
36,Was child able to fling the ball upwards by punching the bag?,Radio Button,false,,,false
37,Did child play collaboratively or competitively?,Radio Button,false,,,false
38, Was child able to apply fevicol?,Radio Button,false,,,false
39,Was child able to do the sprinkling action for salt?,Radio Button,false,,,false
40,Was child able to trace most, if not all patterns?,Radio Button,false,,,false
41,Do you think child will improve in this activity with regular practice?,Radio Button,false,,,false
42,Did child enjoy collecting leaves for this activity?,Radio Button,false,,,false
43,Did child make any designs that took you by surprise? What were they?,Text Box,false,,,false
44,Was child able to colour most shapes correctly?,Radio Button,false,,,false
45,Was child patient enough to finish the entire sheet?,Radio Button,false,,,false
46,Which part of this activity did child enjoy the most?,Radio Button,false,,,false
47,Do you feel that repeating this activity regularly has helped with your child's grip and 40?,Radio Button,false,,,false
48,Was child able to put the cotton buds in?,Radio Button,false,,,false
49,Would child like to use this as a display art in your home?,Radio Button,false,,,false
50,Did child like to make a variety of shapes for shadow play?,Radio Button,false,,,false
51,Did child understand how the shapes got projected on the wall?,Radio Button,false,,,false
52,Did child help you to make this big bubble wand?,Radio Button,false,,,false
53,Did child like this as compared to regular bubble wands?,Radio Button,false,,,false
54,Was child able to maintain 39 throughout the activity?,Radio Button,false,,,false
55,Did child get irritated if they could not finish the task?,Radio Button,false,,,false
56,Was child able to categorize most food items as per taste?,Radio Button,false,,,false
57,Which out of these tastes does child find easiest to identify?,Radio Button,false,,,false
58,Did child touch and feel most, if not all objects?,Radio Button,false,,,false
59,Was child able to classify?,Radio Button,false,,,false
60,Was child open to mixing paints with their fingers?,Radio Button,false,,,false
61,Did child this way of learning about secondary colours?,Radio Button,false,,,false
62,Was child able to make shapes using the molds?,Radio Button,false,,,false
63,Does child like using molds or do they prefer to make objects by hand?,Radio Button,false,,,false
64,Was child observing carefully and patiently?,Radio Button,false,,,false
65,Would child like to solve more complex shapes and patterns?,Radio Button,false,,,false
66,Was child patient throughout the activity?,Radio Button,false,,,false
67,Does child regularly clean crayons and toys after playtime?,Radio Button,false,,,false
68,Did child feel proud of themselves after finishing the tree?,Radio Button,false,,,false
69,Can child think of other designs to do with this technique?,Text Box,false,,,false
70,Was your child able to come up with different shapes objects?,Radio Button,false,,,false
71,Did your child find it difficult or easy to shape the dough with their fingers?,Radio Button,false,,,false
72,Did the child experiment with different colors and techniques on their own?.,Radio Button,false,,,false
73, Did the child share any stories or ideas about their creations?,Radio Button,false,,,false
74,Did child perform the activity with ease?,Radio Button,false,,,false
75, Would child be interested to do this again?,Radio Button,false,,,false
76,Could child do this activity with both hands simultaneously?,Radio Button,false,,,false
77,How eager is child to do activities like these that require 39 and 5?,Radio Button,false,,,false
78,Was child able to make impressions using crayons?,Radio Button,false,,,false
79,Did child use these imprints for any other art and craft?,Radio Button,false,,,false
80,Did child enjoy making this colourful prints frame?,Radio Button,false,,,false
81,Did child think of any designs or patterns to make while pressing palm on paper?,Radio Button,false,,,false
82,Was child comfortable touching the ice cold balloon?,Radio Button,false,,,false
83,Did child enjoy using water colours in this activity?,Radio Button,false,,,false
84,Was child able to do the colouring and spraying water independently?,Radio Button,false,,,false
85,Did child convert this activity into an art piece like a nameplate/ wall hanging/ poster etc.?,Radio Button,false,,,false
86,Did child use these googly eyes for any art and craft projects?,Radio Button,false,,,false
87,Did child ask to make these in different sizes and shapes?,Radio Button,false,,,false
88,Was child able to do most, if not all exercises?,Radio Button,false,,,false
89,Did child get better with practice?,Radio Button,false,,,false
90,Was child able to arrange the matchsticks properly?,Radio Button,false,,,false
91,Was child surprised to see what happened when water was added?,Radio Button,false,,,false
92, Did child enjoy playing with cardboard shoes?,Radio Button,false,,,false
93,Could they use both feet effectively?,Radio Button,false,,,false
94,Did child enjoy chiseling the ice away to find the dinosaur?,Radio Button,false,,,false
95,Would child like to do this activity with any variation? What would they like?,Text Box,false,,,false
96,Did child like colouring the eyes and mouth?,Radio Button,false,,,false
97,Would child like to make more such monster hands?,Radio Button,false,,,false
98,Which part of the activity did child like the most?,Radio Button,false,,,false
99,Would child like to make more animals this way?,Radio Button,false,,,false
100,Did child like collecting different types of leaves?,Radio Button,false,,,false
101,Would child like to make more such bookmarks to gift to friends and family?,Radio Button,false,,,false
102,Does child use this board to practice writing?,Radio Button,false,,,false
103,Would child like similar boards for writing small words?,Radio Button,false,,,false
104,did child enjoy collecting the flowers?,Radio Button,false,,,false
105,Would child like to display this creation in your family living room?,Radio Button,false,,,false
106,Did child like crumpling and tearing of paper?,Radio Button,false,,,false
107,Did child learn about the inside of an anthill?,Radio Button,false,,,false
108,Did child like the idea of sensory play to learn letters and numbers?,Radio Button,false,,,false
109,Do you notice any improvements in child's letter, number and colour recognition after doing this activity repeatedly?,Radio Button,false,,,false
110,Did child add any fun elements to the spider like a bow or a hat?,Radio Button,false,,,false
111,Would child like to make other animals using cable ties?,Radio Button,false,,,false
112,Was child consistent and patient with their efforts?,Radio Button,false,,,false
113,Did child get better with practice?,Radio Button,false,,,false
114,Was child able to do the sieving action?,Radio Button,false,,,false
115,Did child patiently sort out all the chana?,Radio Button,false,,,false
116, Did the child enjoyed doing longer phrases?,Radio Button,false,,,false
117, Do you think hands on leaning lets child remember better?,Radio Button,false,,,false
118,How many shapes were built by the child?,Radio Button,false,,,false
119,What theme did you decide on?,Text Box,false,,,false
120, Were they able to make patterns as requested?,Radio Button,false,,,false
121,What did the child enjoy most while playing with the sand?,Text Box,false,,,false
122,Did child like the idea of making newspaper bags at home?,Radio Button,false,,,false
123,Do they like to use these bags?,Radio Button,false,,,false
124,Did child find moving the hands around interesting? ,Radio Button,false,,,false
125,Did they understand the different nomenclatures used to tell time?,Radio Button,false,,,false
126, Did child expect a rainbow to be formed before you started with the activity? ,Radio Button,false,,,false
127,What was child's reaction after seeing the rainbow get formed?,Radio Button,false,,,false
128,Was child able to make the butterfly flap its wings?,Radio Button,false,,,false
129,Did child ask to make more such butterflies?,Radio Button,false,,,false
130,Did child make a creative bracelet or ring?,Radio Button,false,,,false
131,Did child try to make other pieces of jewelry?,Radio Button,false,,,false
132,Was child able to pick up small objects using a stick?,Radio Button,false,,,false
133,Did child's speed increase with practice?,Radio Button,false,,,false
134,Did child additionally decorate the fruit basket?,Radio Button,false,,,false
135,would child like to make similar fruit baskets to gift to friends and family?,Radio Button,false,,,false
136,was child able to focus throughout the game?,Radio Button,false,,,false
137,Is child able to play even after leveling up the game?,Radio Button,false,,,false
138,Was child able to catch most of the balls?,Radio Button,false,,,false
139,Did child get better at activity with practice?,Radio Button,false,,,false
140,Could child replicate your drawing?,Radio Button,false,,,false
141, Did you enjoy doing this activity together?,Radio Button,false,,,false
142,Did child enjoy doing the setup for this experiment? ,Radio Button,false,,,false
143,Did child observe patiently, the changes happening everyday?,Radio Button,false,,,false
144,Was child able to draw vehicles using the template?,Radio Button,false,,,false
145,Did child try to draw anything besides vehicles?,Radio Button,false,,,false
146,Did child enjoy setting up this activity?,Radio Button,false,,,false
147,Did child try to play this game with friends or siblings?,Radio Button,false,,,false
148, was child curious to see the outcome of this activity?,Radio Button,false,,,false
149,Can child think of any variation to this activity besides the gymnast? What is it?,Text Box,false,,,false
150,Was child able to cut the leaves well?,Radio Button,false,,,false
151,Did child get better at activity with practice?,Radio Button,false,,,false
152,Was child able to match the code most, if not all times?,Radio Button,false,,,false
153,Would child like to solve a longer code next time?,Radio Button,false,,,false
154,Did child enjoy making the shoe template?,Radio Button,false,,,false
155,Was child able to weave through the holes in the shoe and make knots?,Radio Button,false,,,false
156,What part of this activity did child enjoy the most?,Radio Button,false,,,false
157,Would child like to make more name plates for extended family?,Radio Button,false,,,false
158,Did child like this different method of blowing bubbles?,Radio Button,false,,,false
159,Would child like to explore coloured water?,Radio Button,false,,,false
160,Did child like making the flowers?,Radio Button,false,,,false
161,Were they surprised to see the flowers bloom in water?,Radio Button,false,,,false
162,Was child able to create designs using a cotton bud?,Radio Button,false,,,false
163,Would child like to make more artwork using this technique?,Radio Button,false,,,false
164,Did child enjoy this technique of painting?,Radio Button,false,,,false
165,Would child like to turn this into an art piece to put up for display?,Radio Button,false,,,false
166,How many cars did child make?,Radio Button,false,,,false
167,Would child like to hang these cars up for display?,Radio Button,false,,,false
168,Was child able to twist the paper strips?,Radio Button,false,,,false
169,Would child like to make more craft using this technique for friends and family?,Radio Button,false,,,false
170, Did they express any sensory difficulties while writing in foam?,Radio Button,false,,,false
171,What did they write or draw?,text Box,false,,,false
172,Did child enjoy this jewelry making process?,Radio Button,false,,,false
173,What all ornaments did they make?,text Box,false,,,false
174,Did child weigh various objects in the house to see which was heavier and lighter?,Radio Button,false,,,false
175,What did child learn from this activity?,text Box,false,,,false
176,Did child keep trying till they could do the exercise well?,Radio Button,false,,,false
177,Did child get better with practice?,Radio Button,false,,,false
178,Did child come up with new and unique animals to make hand shadows?,Radio Button,false,,,false
179,Did child enjoy guessing each other's shadows?,Radio Button,false,,,false
180,Was child able to participate for most tasks in this activity?,Radio Button,false,,,false
181,Does child use these tongs to pick things up?,Radio Button,false,,,false
182,Did child use 7 in colouring the paper strip?,Radio Button,false,,,false
183,Does child try the spinner at various locations and various heights?,Radio Button,false,,,false
184,Did child observe the experiment carefully?,Radio Button,false,,,false
185,Did they enjoy putting the food colour in both liquids?,Radio Button,false,,,false
186,Did child stick the sticks on their own or did they require help?,Radio Button,false,,,false
187,Does child fill the feeder and maintain cleanliness?,Radio Button,false,,,false
188,Can child think of any other design for mobile stand using same materials?,Radio Button,false,,,false
189,Does child like to make utility items from things available at home?,Radio Button,false,,,false
190,Did child participate in making the weighing scale?,Radio Button,false,,,false
191,Did child use this to weigh various materials?,Radio Button,false,,,false
192,Was child able to perform this activity? ,Radio Button,false,,,false
193,Did child face any difficulties ?,Radio Button,false,,,false
194, Could child manage to move all balls in one toss?,Radio Button,false,,,false
195,Did child keep trying even if they failed?,Radio Button,false,,,false
196,Does child usually like DIY activities?,Radio Button,false,,,false
197,What did child decide to use the finished jar for?,text Box,false,,,false
198,Was child able to complete the activity?,Radio Button,false,,,false
199,Did child get better with practice?,Radio Button,false,,,false
200,Was child able to make the stress balloon independently?,Radio Button,false,,,false
201,Does child use this balloon in times of stress?,Radio Button,false,,,false
202,Was child patient enough to put the pom pom through the holes in the cardboard?,Radio Button,false,,,false
203,Did child come up with any trick or strategy?,Radio Button,false,,,false
204,Was child keen on winning the game?,Radio Button,false,,,false
205,Does child like to play this game with friends?,Radio Button,false,,,false
206,Was child thrilled to make a rewritable pad at home?,Radio Button,false,,,false
207,Does child use this pad regularly?,Radio Button,false,,,false
208,Did child like this new technique of paper mache?,Radio Button,false,,,false
209,Would child like to make more such art using this technique?,Radio Button,false,,,false
210,Did child like this new style of painting?,Radio Button,false,,,false
211,Would child like to make more such art using this technique?,Radio Button,false,,,false
212,Was child keen on recycling an old box?,Radio Button,false,,,false
213,Would child like to make more things using old boxes?,Radio Button,false,,,false
214,Did child use these butterflies in any art work/ show piece?,Radio Button,false,,,false
215,Can child think of any other things they would like to make using this technique? What are they?,text Box,false,,,false
216,Can child think of any other animals to make using this idea?,Radio Button,false,,,false
217,Would child like to make more octo pops and gift to friends?,Radio Button,false,,,false
218,Did child find this method of learning interesting?,Radio Button,false,,,false
219,Would child like to explore similar grammar activities?,Radio Button,false,,,false
220,Was child excited to make their own stickers?,Radio Button,false,,,false
221,Would child like to make more stickers?,Radio Button,false,,,false
222,Was child able to do the weaving pattern of thread?,Radio Button,false,,,false
223,Did child use this as an art piece to display?,Radio Button,false,,,false
224,Did child assemble everything themselves?,Radio Button,false,,,false
225,Does child play with this DIY toy often?,Radio Button,false,,,false
226, Did they ask for assistance or prefer to work independently?,Radio Button,false,,,false
227,Did they show interest in wearing the jewelry themselves or giving it as a gift?,Radio Button,false,,,false
228,How did your child feel after completing the activity?,Radio Button,false,,,false
229,Did child show interest in making more dolls to gift to friends?,Radio Button,false,,,false
230,What did your child enjoy most about painting the t-shirts together? ,Checkbox,true,,,false
231,Did child find t-shirt painting easy or challenging?,Radio Button,false,,,false
232,Which materials did child like to use?,Checkbox,true,,,false
233,What can you learn from the elements of nature, that you selected for your nature collage?,Text box,false,,,false
234,What part of this activity did child enjoy the most?,Checkbox,true,,,false
235,,,false,,,false
236,Was child eager to make festival decorations at home?,Radio Button,false,,,false
237,Would child be able to teach this activity to a younger child independently?,Radio Button,false,,,false
238,Did child understand why oil floats on water?,Radio Button,false,,,false
239,Would child like to try the same activity using different liquids?,Radio Button,false,,,false
240, Was child able to stack and balance the arrangement?,Radio Button,false,,,false
241,Did the stack collapse at any point of time?,Radio Button,false,,,false
242, Did child make more than 1 park bench? ,Radio Button,false,,,false
243,Did child think of any unique design for the bench?,Radio Button,false,,,false
244,Did child follow all the steps to make the cycle patiently?,Radio Button,false,,,false
245,Did child add some unique elements to their cycle?,Radio Button,false,,,false
246,Was child able to figure out the puzzle?,Radio Button,false,,,false
247, How much time and how many attempts did it take?,Text box,false,,,false
248,Did child enjoy making the bees?,Radio Button,false,,,false
249,Does child use this light up activity as  a showpiece or wall art?,Radio Button,false,,,false
250,Did child enjoy setting up this puzzle activity?,Radio Button,false,,,false
251,Was child able to focus the whole time and solve the puzzle?,Radio Button,false,,,false
252,Was child able to set up the activity independently?,Radio Button,false,,,false
253,Was child amazed to see the water dispenser in action?,Radio Button,false,,,false
254,Did child expect the balloon to not pop?,Radio Button,false,,,false
255,Does child enjoy doing science experiments at home?,Radio Button,false,,,false
256,Did child like making patterns with thread?,Radio Button,false,,,false
257,Did child use the big flower to make any wall art or showpiece?,Radio Button,false,,,false
258,Did child enjoy setting up this activity?,Radio Button,false,,,false
259,Can child think of any variations to be added to this activity? What are they?,Text box,false,,,false
260,Did child follow all the steps to make the frog patiently?,Radio Button,false,,,false
261,Would child like to make more such jumping animal toys?,Radio Button,false,,,false
262,Did child observe patiently?,Radio Button,false,,,false
263,Did child understand the reason for colour spreading through different temperature of water at different rates?,Radio Button,false,,,false
264,Was child able to observe the experiment patiently?,Radio Button,false,,,false
265,Did child understand the reason behind the volcanic eruptions?,Radio Button,false,,,false
266,Was child able to fold the paper as shown in the video?,Radio Button,false,,,false
267,Would child like to make more mobile stands to give to family and friends?,Radio Button,false,,,false
268,Was child able to wrap the ribbon around the ruler?,Radio Button,false,,,false
269,Would child like to make more flowers in different colours?,Radio Button,false,,,false
270,Was child able to fold the paper as shown in the video?,Radio Button,false,,,false
271,Would child like to make more tops to share with friends?,Radio Button,false,,,false
272,Was child able to replicate pattern properly?,Radio Button,false,,,false
273,Would child like to explore more patterns?,Radio Button,false,,,false
274,Did child patiently stick all the popsicle sticks ?,Radio Button,false,,,false
275,Does child keep the bird nest clean?,Radio Button,false,,,false
276,Was child interested in constructing the marble track?,Radio Button,false,,,false
277,Does child use marble track while playing with friends?,Radio Button,false,,,false
278,Was child curious to see what happens to the ball?,Radio Button,false,,,false
279,Did child understand the reason of this experiment?,Radio Button,false,,,false
280,How many bookmarks did child make?,Radio Button,false,,,false
281,Would child like to make more bookmarks for friends and family?,Radio Button,false,,,false
282,Did child make more coasters for family to use?,Radio Button,false,,,false
283,What else can child think of to repurpose old lids?,Text Box,false,,,false
284,Did child enjoy this new technique?,Radio Button,false,,,false
285,Would child like to create more art using this technique?,Radio Button,false,,,false
286,Was child interested in making complex geometrical figures?,Radio Button,false,,,false
287,Does child prefer learning geometry by this method?,Radio Button,false,,,false
288,Did child like this new technique of creating art?,Radio Button,false,,,false
289,Would child like to demonstrate this activity to a friend?,Radio Button,false,,,false
290,Did child make more than one nutty hero?,Radio Button,false,,,false
291,Can child think of other things from the kitchen to use ?,Text Box,false,,,false
292, Did your child learn any new skills or gain any insights from this activity?,Radio Button,false,,,false
293, Did your child express interest in exploring other carving/ sculpting activities after completing this one?,Radio Button,false,,,false
294,How many different objects was child able to design using geometrical shapes?,Radio Button,false,,,false
295,Did you come up with new ideas? If yes, what are those objects you thought?,Text Box,false,,,false
296,What part of this activity did child find most interesting?,Checkbox,true,,,false
297,Did child read up some extra information about this topic?,Radio Button,false,,,false
298,Did child try and make different shapes out of tissue paper apart from butterfly?,Radio Button,false,,,false
299,Did child try to do some other activities related to static energy as well?,Radio Button,false,,,false
300,How well do you think your paper plane flew? ,Radio Button,false,,,false
301,What factors do you think affected its flight?,Text Box,false,,,false
