Question_ID,Feedback Question 1,Type,Option 1,Option 2,Option 3,Option 4
168,Does child like to make utility items from things available at home?,Radio Button,Yes,No,Sometimes
124,Did child use this to weigh various materials?,Radio Button,Yes,No,None
53,Did child face any difficulties ?,Radio Button,Yes,No,None
64,Did child keep trying even if they failed?,Radio Button,Yes,No,Most of the times,Sometimes
283,What did child decide to use the finished jar for?,text Box,None,None,None
61,Did child get better with practice?,Radio Button,Yes,No,Can't Say
178,Does child use this balloon in times of stress?,Radio Button,Yes,No,Most of the times,Sometimes
29,Did child come up with any trick or strategy?,Radio Button,Yes,No,None
169,Does child like to play this game with friends?,Radio Button,Yes,No,None
181,Does child use this pad regularly?,Radio Button,yes,No,None
344,Would child like to make more such art using this technique?,Radio Button,Yes,No,None
344,Would child like to make more such art using this technique?,Radio Button,Yes,No,Can't Say
348,Would child like to make more things using old boxes?,Radio Button,Yes,No,None
5,Can child think of any other things they would like to make using this technique? What are they?,text Box,None,None,None
342,Would child like to make more octo pops and gift to friends?,Radio Button,Yes,No,Can't Say
331,Would child like to explore similar grammar activities?,Radio Button,Yes,No,None
343,Would child like to make more stickers?,Radio Button,Yes,No,Can't Say
123,Did child use this as an art piece to display?,Radio Button,Yes,No,None
171,Does child play with this DIY toy often?,Radio Button,Yes,No,None
136,Did they show interest in wearing the jewelry themselves or giving it as a gift?,Radio Button,Wearing themselves,Giving as a gift,Both
98,Did child show interest in making more dolls to gift to friends?,Radio Button,Yes,No,None
57,Did child find t-shirt painting easy or challenging?,Radio Button,Easy,Challenging,Can't Say
281,"What can you learn from the elements of nature, that you selected for your nature collage?",Text box,None,None,None
318,Would child be able to teach this activity to a younger child independently?,Radio Button,Yes,No,Can't Say
354,Would child like to try the same activity using different liquids?,Radio Button,Yes,No,None
131,Did the stack collapse at any point of time?,Radio Button,Yes,No,None
102,Did child think of any unique design for the bench?,Radio Button,Yes,No,None
21,Did child add some unique elements to their cycle?,Radio Button,Yes,No,None
202,How much time and how many attempts did it take?,Text box,None,None,None
180,Does child use this light up activity as  a showpiece or wall art?,Radio Button,Wall art,Showpiece,as gift for friend
225,Was child able to focus the whole time and solve the puzzle?,Radio Button,Yes,No,None
249,Was child amazed to see the water dispenser in action?,Radio Button,Yes,No,None
165,Does child enjoy doing science experiments at home?,Radio Button,Yes,No,None
119,Did child use the big flower to make any wall art or showpiece?,Radio Button,Yes,No,None
7,Can child think of any variations to be added to this activity? What are they?,Text box,None,None,None
346,Would child like to make more such jumping animal toys?,Radio Button,Yes,no,Can't say
113,Did child understand the reason for colour spreading through different temperature of water at different rates?,Radio Button,Yes,No,Can't say
112,Did child understand the reason behind the volcanic eruptions?,Radio Button,Yes,No,None
340,Would child like to make more mobile stands to give to family and friends?,Radio Button,Yes,No,None
339,Would child like to make more flowers in different colours?,Radio Button,Yes,No,Can't say
349,Would child like to make more tops to share with friends?,Radio Button,Yes,No,Can't say
330,Would child like to explore more patterns?,Radio Button,Yes,No,Can't say
167,Does child keep the bird nest clean?,Radio Button,Yes,No,None
176,Does child use marble track while playing with friends?,Radio Button,Yes,No,Sometimes
114,Did child understand the reason of this experiment?,Radio Button,Yes,No,Can't Say
336,Would child like to make more bookmarks for friends and family?,Radio Button,Yes,No,Can't Say
297,What else can child think of to repurpose old lids?,Text Box,None,None,None
323,Would child like to create more art using this technique?,Radio Button,Yes,No,Can't Say
172,Does child prefer learning geometry by this method?,Radio Button,Yes,No,Can't Say
324,Would child like to demonstrate this activity to a friend?,Radio Button,Yes,No,None
9,Can child think of other things from the kitchen to use ?,Text Box,None,None,None
150,Did your child express interest in exploring other carving/ sculpting activities after completing this one?,Radio Button,Yes,No,None
139,"Did you come up with new ideas? If yes, what are those objects you thought?",Text Box,None,None,None
94,Did child read up some extra information about this topic?,Radio Button,Yes,No,None
106,Did child try to do some other activities related to static energy as well?,Radio Button,Yes,No,None
298,What factors do you think affected its flight?,Text Box,None,None,None
333,Would child like to make a more decorative dream catcher or add variations to design next time?,Radio Button,Yes,No,Can't Say
327,Would child like to do a similar activity with life stages of different insects?,Radio Button,Yes,No,Can't Say
95,Did child record their observations?,Radio Button,Yes,No,Sometimes
13,Could child arrange the moons in correct order?,Radio Button,Yes,No,None
32,Did child do the calculations well?,Radio Button,Yes,No,None
110,Did child try to use the water fountain for any specific purpose like watering the plants/ giving water to birds and animals?,Radio Button,Yes,No,None
372,Did child use creativity to decorate the stand?,Radio Button,Yes,No,None
116,Did child understand why the sun started spinning?,Radio Button,Yes,No,None
296,What do you think was the reason for water rising in the jar?,Text Box,None,None,None
295,What do you think is the reason for the plate to stick to the glass jar?,Text Box,None,None,None
248,Was child amazed to learn about the functioning of a well?,Radio Button,Yes,No,Can't Say
191,How did you feel assigning tasks to all the family members? Did you find it to be easy or challenging?,Radio Button,Easy,Challenging,None
317,Why do you think the volcano erupted?,Text Box,None,None,None
362,Would you like to explore more experiments involving static electricity in the future? ,Radio Button,Yes,No,Maybe
159,Do you feel confident teaching this experiment to a group of younger kids?,Radio Button,Yes,No,Can't Say
184,How did changing the angle of the hair dryer affect the ball's behaviour?,Radio Button,Ball continued to float,Ball dropped down,None
359,Would you like to demonstrate this activity independently in school or in front of friends?,Radio Button,Yes,No,Can't Say
143,Did you learn about melting temperature of ice in this experiment?,Radio Button,Yes,No,Can't Say
299,What new science concept did you learn today,Text Box,None,None,None
11,Can you think of any variations of this activity?,Text Box,None,None,None
367,Would you like to teach this activity to younger kids?,Radio Button,Yes,No,Can't Say
363,Would you like to make different boat designs using the same material?,Radio Button,Yes,No,Can't Say
358,Would you be able to demonstrate this activity to  a friend?,Radio Button,Yes,No,Can't Say
364,Would you like to make more such furniture pieces using straws?,Radio Button,Yes,No,Maybe
145,Did you think of any puzzles and challenge parent?,Radio Button,Yes,No,None
144,Did you think of any other waste material that can be used to make a house? What was it?,Text Box,None,None,None
360,Would you like to demonstrate this experiment to friends and family?,Radio Button,Yes,No,None
308,What were some of the challenges you faced while building your bridge?,Checkboxes,Strength of design,Repeated failures,Thinking of designs,Testing for strength
12,Can you think of other such simple experiments you can try at home?,Text Box,None,None,None
2,an you think of other ways to design the catapult?,Radio Button,Yes,No,None
361,Would you like to do similar activities to sharpen their reflexes?,Radio Button,Yes,No,Can't Say
294,What do you think is the reason for the bottle shoot?,Text Box,None,None,None
366,Would you like to share your experiences?,Text Box,None,None,None
373,What did you learn about your child's imagination and creativity through this  activity?,Text Box,None,None,None
272,Were there any specific details or features your child pointed out while showing you their artwork?,Text Box,None,None,None
190,How did you feel about the overall experience of engaging in this activity with your child?,Text Box,None,None,None
10,Can you encourage child to do this activity again with non dominant hand?,Text Box,None,None,None
282,What colours or types of glitter did your child choose to include in the bottle? ,Text Box,None,None,None
355,Would child like to try various other shapes instead of fish? Would you like to share your experience?,Text Box,None,None,None
101,Did child think of any other uses like a bookmark?,Text Box,None,None,None
374,What types of flowers did you use?,Text Box,None,None,None
375,Have you noticed any change in child's grip and fine motor skills after this activity? Would you like to share your experience?,Text Box,None,None,None
376,Would child like to carry out the same experiment in other liquids as well?,Text Box,None,None,None
377,Can child think of any other home applications of this activity like shower? Did you explain the workings behind it?,Text Box,None,None,None
378,Do you feel such projects help to develop personality and how?,Text Box,None,None,None
379,Do you feel that such hands on experiments give you  a better understanding of the scientific concept?,Text Box,None,None,None
