Act_id,associated Skill 1,associated Skill 2,associated skill 3,associated skill 4,Activity Title,1,2,3,4,5,6,7,8,9,10,11,12,Feedback Question 1,Type,Option 1,Option 2,Option 3,Option 4,Feedback Question 2,Type_1,Option 1_1,Option 2_1,Option 3_1,Option 4_1,Feedback Question 3,Type_2
276,40,45,39,1,Coconut House,None,None,None,None,None,None,Y,Y,None,None,None,None, Were you interested throughout the process of making the house?,Radio Button,Yes,No,None,None,Did you think of any other waste material that can be used to make a house? What was it?,Text Box,None,None,None,None,None,None,None
277,1,25,None,None,Bubbling Volcano Frenzy,None,None,None,None,None,None,Y,Y,None,None,None,None,Did you understand the reason behind this bubbling volcano?,Radio Button,Yes,No,None,None,Would you like to demonstrate this experiment to friends and family?,Radio Button,Yes,No,None,None,None,None,None
278,5,27,62,63,The Invisible Force,None,None,None,None,None,None,None,Y,Y,Y,None,None, Did your bridge turn out the way you expected it to?  ,Radio Button,Yes,No,None,None,What were some of the challenges you faced while building your bridge?,Checkboxes,Strength of design,Repeated failures,Thinking of designs,Testing for strength,None,None
279,60,57,59,58,Fun with Circuits,None,None,None,None,None,None,None,Y,Y,Y,None,None,How did you feel  during the experiment with the paper clip switch? ,Radio Button,Excited,Curious,Anxious,Unsure,Can you think of other such simple experiments you can try at home?,Text Box,None,None,None,None,None,None
280,7,59,8,None,Popsicle Launcher,None,None,None,None,None,None,None,Y,Y,None,None,None,What part of this activity did you enjoy the most?,Radio Button,Setting up the catapult,Using the catapult,None,None,an you think of other ways to design the catapult?,Radio Button,Yes,No,None,None,None,None
281,45,51,24,None,Print your Hand,None,None,None,None,None,None,Y,Y,Y,None,None,None,Were you able to catch the cardboard squares promptly?,Radio Button,Yes,No,Sometimes,None,Would you like to do similar activities to sharpen their reflexes?,Radio Button,Yes,No,Can't Say,None,None,None
282,1,45,5,None,Fogg Rocket,None,None,None,None,None,None,None,Y,Y,None,None,None,Were you curious to see what happens in this experiment?,Radio Button,Yes,No,None,None,What do you think is the reason for the bottle shoot?,Text Box,None,None,None,None,None,None
283,40,1,None,None,Tension Trick,None,None,None,None,None,None,Y,Y,None,None,None,None,Did you try out several permutations and combinations to get the experiment right?,Radio Button,Yes,No,None,None,Would you like to share your experiences?,Text Box,None,None,None,None,None,None
